{
  "document_id": "doc-pod-001",
  "pod_number": "POD-2026-08101",
  "shipment_id": "SHP-000001",
  "awb_number": "AWB77829391",
  "delivery_status": "DELIVERED",
  "delivery_date": "2026-08-11",
  "delivery_time": "14:25",
  "receiver_name": "Budi Santoso",
  "receiver_company": "Gudang Bandung Cabang 1",
  "quantity_received": 10,
  "condition": "GOOD",
  "signature_present": true,
  "signature_bbox": [420, 680, 560, 780],
  "signature_confidence": 0.96,
  "stamp_present": true,
  "stamp_bbox": [480, 690, 580, 790],
  "remarks": "Barang diterima lengkap dan segel utuh.",
  "evidence": [
    {
      "field_name": "signature_present",
      "raw_value": "wet_signature_detected",
      "normalized_value": true,
      "confidence": 0.96,
      "source": {
        "document_id": "doc-pod-001",
        "document_type": "POD",
        "page_number": 1,
        "bbox": [420, 680, 560, 780]
      },
      "extraction_method": "ocr"
    }
  ]
}
